file,course,section,question_id,status,difficulty,option_key,option_letter,issues,sample
content/cpa/tcp/questions.json,cpa,tcp,tcp-gen-1348,draft,hard,2,C,correct-option-marked-incorrect,"This answer is incorrect. It is the tax liability on the current year estimated income. However, the corporation has taxable income over $1 "
content/cpa/tcp/questions.json,cpa,tcp,tcp-gen-1351,draft,easy,2,C,wrong-option-marked-correct,"100% would only be correct if all of ABC Partnership's sales were attributable to State A, which is not the case since $400,000 in sales wer"
content/cpa/tcp/questions.json,cpa,tcp,tcp-gen-1356,retired,hard,2,C,wrong-option-marked-correct,"This option incorrectly calculates the R&D credit and WOTC. The R&D credit is calculated as 20% of QREs exceeding a base amount. The Work Op"
content/cpa/tcp/questions.json,cpa,tcp,tcp-gen-1358,draft,easy,1,B,wrong-option-marked-correct,"This is the average of the basis and fair market value, but is not the correct amount to increase Allen's capital account."
content/cpa/tcp/questions.json,cpa,tcp,tcp-gen-1358,draft,easy,3,D,wrong-option-marked-correct,"This is the sum of the basis and fair market value, but is not the correct amount to increase Allen's capital account."
content/cpa/tcp/questions.json,cpa,tcp,tcp-gen-1359,draft,hard,3,D,wrong-option-marked-correct,"This answer incorrectly calculates the distributive share. It likely adds the guaranteed payment to the partnership net income and then mult"
content/cpa/tcp/questions.json,cpa,tcp,tcp-gen-1367,draft,hard,2,C,wrong-option-marked-correct,"This answer incorrectly calculates the general business credit limitation. The correct calculation involves comparing the net income tax, te"
content/cpa/tcp/questions.json,cpa,tcp,tcp-gen-1382,draft,easy,2,C,wrong-option-marked-correct,"This answer is double the actual WOTC amount and doesn't reflect the correct percentage or wage base."
content/cpa/tcp/questions.json,cpa,tcp,tcp-gen-1385,draft,hard,3,D,wrong-option-marked-correct,"This answer calculates as (\$3,000,000 + \$500,000 + \$200,000)/ \$5,000,000 = 74%. The correct sales factor for State A is (3,000,000+200,0"
content/cpa/tcp/questions.json,cpa,tcp,tcp-gen-1386,draft,easy,2,C,wrong-option-marked-correct,"Section 179 expenses are passed through to partners via Schedule K-1 from Form 1065, and then reported on Form 4562 by the partner. It is no"
content/cpa/tcp/questions.json,cpa,tcp,tcp-gen-1389,draft,medium,1,B,correct-option-marked-incorrect,"This is the incorrect amount if you take 21% of $500,000, then don't compare against the current year."
content/cpa/tcp/questions.json,cpa,tcp,tcp-gen-1400,draft,hard,0,A,correct-option-marked-incorrect,"This answer is incorrect because it does not correctly calculate the interaction between the R&D credit and the WOTC. Specifically, it doesn"
content/cpa/tcp/questions.json,cpa,tcp,tcp-gen-1410,draft,medium,1,B,wrong-option-marked-correct,"While this is the correct tax liability for the current year, the question asks for the minimum annual payment. This is misleading because t"
content/cpa/tcp/questions.json,cpa,tcp,tcp-gen-1414,deprecated,medium,1,B,wrong-option-marked-correct,"This option is not correct. The research credit calculation is 20% of the excess of QREs over the base amount."
content/cpa/tcp/questions.json,cpa,tcp,tcp-gen-1414,deprecated,medium,2,C,wrong-option-marked-correct,"This option is not correct. The research credit calculation is 20% of the excess of QREs over the base amount."
content/cpa/tcp/questions.json,cpa,tcp,tcp-gen-1420,draft,easy,3,D,wrong-option-marked-correct,"This calculation incorrectly inverts the ratio and uses State A's payroll instead of State B's. The correct calculation is State B Payroll /"
content/cpa/tcp/questions.json,cpa,tcp,tcp-gen-1423,draft,hard,0,A,wrong-option-marked-correct,"This answer represents the total tax liability before credits and is not correct because the general business credit is limited to a portion"
content/cpa/tcp/questions.json,cpa,tcp,tcp-gen-1431,draft,medium,1,B,correct-option-marked-incorrect,"Incorrect. This amount would be obtained by multiplying the taxable income by 21% and dividing by 2 instead of 4."
content/cpa/tcp/questions.json,cpa,tcp,tcp-gen-1432,draft,medium,0,A,wrong-option-marked-correct,"The location of incorporation is not a factor in determining if a business is unitary. The test is based on the factors listed in the correc"
content/cpa/tcp/questions.json,cpa,tcp,tcp-gen-1436,retired,hard,1,B,correct-option-marked-incorrect,"This option Balculates the WOTC at $4,000, which is based on an incorrect percentage and doesn't consider the wage reduction impact on taxab"
content/cpa/tcp/questions.json,cpa,tcp,tcp-gen-1455,draft,medium,0,A,correct-option-marked-incorrect,"This answer is incorrect because the S Corp can claim WOTC for Employee A and B, as well as Employee C if the S Corp isn't a large business."
content/cpa/tcp/questions.json,cpa,tcp,tcp-gen-1472,draft,hard,2,C,wrong-option-marked-correct,"This answer does not account for the reduced credit election under IRC 280C or use the correct credit percentage."
content/cpa/tcp/questions.json,cpa,tcp,tcp-gen-1473,draft,hard,0,A,correct-option-marked-incorrect,"Alpha Co. and Beta Co. only is incorrect because the holding company, Apex Corp., exerts centralized management and control, and should be i"
content/cpa/tcp/questions.json,cpa,tcp,tcp-9k-001,approved,easy,3,D,wrong-option-marked-correct,"This is the correct maximum amount as this is the regular contribution limit plus catch-up amount."
content/cpa/tcp/questions.json,cpa,tcp,tcp-9k-016,approved,medium,1,B,wrong-option-marked-correct,"This is the correct amount of the deduction for one-half of the self-employment tax."
content/cpa/tcp/questions.json,cpa,tcp,tcp-9k-016,approved,medium,2,C,correct-option-marked-incorrect,"This is an incorrect calculation using the taxable income instead of the self-employment income."
functions/content-cpa/aud/questions.json,,,aud-d10-011,approved,hard,2,C,option-letter-prefix-mismatch,"B) Management bias, as indicated by consistently favorable estimates, raises concerns about the fairness and reliability of financial report"
functions/content-cpa/aud/questions.json,,,aud-d11-015,approved,easy,2,C,option-letter-prefix-mismatch,"B) Performing substantive analytical procedures is the most effective approach because it allows the auditor to develop an independent expec"
functions/content-cpa/aud/questions.json,,,aud-d12-015,approved,easy,2,C,option-letter-prefix-mismatch,"B) CORRECT: The clearly trivial threshold is designed to capture immaterial misstatements that are so small they don't need to be tracked in"
functions/content-cpa/aud/questions.json,,,aud-d12-022,approved,hard,2,C,option-letter-prefix-mismatch,"B) CORRECT: Prior-period misstatements can have a 'rollover' effect, impacting current-period accounts (e.g., inventory). Auditors must asse"
functions/content-cpa/aud/questions.json,,,aud-d13-024,approved,hard,3,D,option-letter-prefix-mismatch,"B) CORRECT: When prior-period financial statements are restated, the auditor must audit the restatement adjustments to ensure they are appro"
functions/content-cpa/aud/questions.json,,,aud-d2-015,approved,easy,3,D,option-letter-prefix-mismatch,"B) CORRECT: AICPA peer review programs mandate that firms performing audit, review, compilation (with disclosures), or attestation services "
functions/content-cpa/aud/questions.json,,,aud-d3-025,approved,medium,2,C,wrong-option-marked-correct,"The valuation assertion deals with whether accounts payable are recorded at the correct amount. While the search for unrecorded liabilities "
functions/content-cpa/aud/questions.json,,,aud-eth-003,approved,hard,1,B,correct-option-marked-incorrect,"A 7-year rotation period is incorrect under SEC rules for audit partner rotation; the requirement is 5 years."
functions/content-cpa/aud/questions.json,,,aud-gen-1123,draft,easy,0,A,wrong-option-marked-correct,"Assuming the client's records are correct without investigation is inappropriate and violates the auditor's responsibility to obtain suffici"
functions/content-cpa/aud/questions.json,,,aud-gen-1125,draft,hard,2,C,wrong-option-marked-correct,"While $150,000 is the correct projection, the increased audit effort required is not a limitation unique to non-statistical sampling."
functions/content-cpa/aud/questions.json,,,aud-gen-1146,draft,medium,1,B,correct-option-marked-incorrect,"Option B is incorrect because management's review doesn't negate the fact that the CPA firm is essentially auditing its own work. Independen"
functions/content-cpa/aud/questions.json,,,aud-gen-1189,draft,easy,3,D,wrong-option-marked-correct,"Tracing cash receipts primarily addresses the completeness assertion, confirming that cash received was properly recorded and applied to the"
functions/content-cpa/aud/questions.json,,,aud-gen-1241,draft,hard,3,D,correct-option-marked-incorrect,"This answer is incorrect because it results from using the incorrect confidence factor, such as the 99% confidence factor."
functions/content-cpa/aud/questions.json,,,aud-gen-1272,draft,hard,2,C,wrong-option-marked-correct,"While adjusting the financial statements isn't correct in this scenario, disclosing the event is required."
functions/content-cpa/aud/questions.json,,,aud-gen-1309,draft,easy,0,A,wrong-option-marked-correct,"Obtaining cutoff information is crucial to ensure that inventory is recorded in the correct accounting period. The auditor needs to determin"
functions/content-cpa/aud/questions.json,,,aud-gen-1315,draft,easy,0,A,wrong-option-marked-correct,"Requesting the customer to change their records is inappropriate as the customer's records are likely correct based on the shipping terms."
functions/content-cpa/bar/questions.json,,,bar-139,approved,hard,2,C,option-letter-prefix-mismatch,"B) CORRECT: WACC is the appropriate discount rate for Free Cash Flow to the Firm (FCFF) because FCFF represents the cash flow available to a"
functions/content-cpa/bar/questions.json,,,bar-d10-021,approved,hard,3,D,option-letter-prefix-mismatch,"B) If the performance condition is probable of being achieved, expense is recognized over the requisite service period; the probability asse"
functions/content-cpa/bar/questions.json,,,bar-d11-014,approved,medium,3,D,option-letter-prefix-mismatch,"B) CORRECT: Tax-exempt municipal bond interest is a permanent difference because it is included in book income but is never subject to feder"
functions/content-cpa/bar/questions.json,,,bar-ta-003,retired,hard,0,A,wrong-option-marked-correct,"Why option A is CORRECT in isolation - The present value of lease payments being at least 90% of the asset's fair value IS a valid finance l"
functions/content-cpa/bar/questions.json,,,bar-ta-003,retired,hard,1,B,wrong-option-marked-correct,"Why option B is CORRECT in isolation - Ownership transfer and a purchase option reasonably certain to be exercised are both valid finance le"
functions/content-cpa/bar/questions.json,,,bar-ta-003,retired,hard,2,C,wrong-option-marked-correct,"Why option C is CORRECT in isolation - A lease term for the major part (≥75%) of the asset's remaining economic life IS a valid finance leas"
functions/content-cpa/bar/questions.json,,,bar-gen-0968,draft,medium,0,A,correct-option-marked-incorrect,"This answer incorrectly calculates the change in break-even point by either using the incorrect formula or by not calculating the break-even"
functions/content-cpa/bar/questions.json,,,bar-gen-0968,draft,medium,3,D,wrong-option-marked-correct,"This answer incorrectly calculates the change in break-even point. The calculation incorrectly assumes the break even goes down, not up. The"
functions/content-cpa/bar/questions.json,,,bar-gen-0992,draft,hard,2,C,wrong-option-marked-correct,"This option incorrectly multiplies the correct answer by the sales mix ratio of Alpha."
functions/content-cpa/bar/questions.json,,,bar-gen-1004,draft,hard,3,D,wrong-option-marked-correct,"This would only be the correct answer if there was no change in value of the hedging instrument, which is not the case based on the facts pr"
functions/content-cpa/bar/questions.json,,,bar-gen-1036,draft,hard,1,B,correct-option-marked-incorrect,"B) $2,950,000 decrease is incorrect because it misinterprets the impact of the bond issuance costs on the capital projects fund balance; the"
functions/content-cpa/bar/questions.json,,,bar-gen-1041,draft,easy,1,B,wrong-option-marked-correct,"This answer incorrectly adds the unspent bond proceeds to the correct calculation."
functions/content-cpa/bar/questions.json,,,bar-gen-1046,draft,hard,1,B,correct-option-marked-incorrect,"This answer uses an incorrect sales mix or calculation of the weighted-average contribution margin."
functions/content-cpa/bar/questions.json,,,bar-gen-1062,draft,hard,0,A,correct-option-marked-incorrect,"Option A is incorrect because it understates the positive impact of the best-case scenario and overstates the negative impact of the worst-c"
functions/content-cpa/bar/questions.json,,,bar-gen-1062,draft,hard,1,B,wrong-option-marked-correct,"Option B is the closest to the correct answer. The probability-weighted NPV considers the likelihood of different scenarios affecting raw ma"
functions/content-cpa/bar/questions.json,,,bar-gen-1086,draft,hard,0,A,correct-option-marked-incorrect,"This answer is incorrect because it doesn't accurately reflect the calculations for the composite unit break-even point and the subsequent a"
functions/content-cpa/bar/questions.json,,,bar-gen-1093,draft,easy,3,D,wrong-option-marked-correct,"1.50 is not the correct calculation of current assets divided by current liabilities."
functions/content-cpa/bar/questions.json,,,bar-gen-1102,draft,hard,2,C,correct-option-marked-incorrect,"4,000 units is incorrect. This is a plausible answer that results from dividing total fixed costs by Beta's contribution margin only, ignori"
functions/content-cpa/bar/questions.json,,,bar-gen-1105,draft,hard,0,A,correct-option-marked-incorrect,"The calculation is incorrect. While the explanation mentions long-term debt, the times interest earned focuses primarily on interest obligat"
functions/content-cpa/bar/questions.json,,,bar-gen-1125,draft,medium,1,B,correct-option-marked-incorrect,"This answer is incorrect. It is the result of errors in calculating either the inventory conversion period, receivables collection period, o"
functions/content-cpa/bar/questions.json,,,bar-gen-1147,draft,easy,3,D,wrong-option-marked-correct,"This answer adds 0.5 to the correct answer, which is not part of the calculation."
functions/content-cpa/bar/questions.json,,,bar-gen-1159,draft,hard,0,A,correct-option-marked-incorrect,"15,000 units is incorrect. While close to a preliminary calculation, it doesn't fully account for the interdependency of the product mix and"
functions/content-cpa/bar/questions.json,,,bar-gen-1165,draft,medium,3,D,wrong-option-marked-correct,"The correct increase in ROE is 4%. The closest answer is an increase of 2%, but it is not the best answer."
functions/content-cpa/bar/questions.json,,,bar-gen-1188,draft,medium,1,B,wrong-option-marked-correct,"This answer incorrectly subtracts the payable deferral period. The correct formula includes subtracting payable deferral period."
functions/content-cpa/bar/questions.json,,,bar-gen-1190,draft,hard,0,A,correct-option-marked-incorrect,"8,000 units is incorrect because it doesn't properly account for the weighted average contribution margin and total fixed costs."
functions/content-cpa/bar/questions.json,,,bar-gen-1193,draft,medium,0,A,correct-option-marked-incorrect,"This option incorrectly calculates the collections by either adding or subtracting a wrong amount or not fully accounting for all three comp"
functions/content-cpa/bar/questions.json,,,bar-gen-1204,draft,medium,0,A,correct-option-marked-incorrect,"This answer is incorrect because it only considers the fixed costs and ignores the contribution margin of each product."
functions/content-cpa/bar/questions.json,,,bar-gen-1223,draft,medium,2,C,wrong-option-marked-correct,"This calculates the correct variance amount but incorrectly classifies it as favorable instead of unfavorable."
functions/content-cpa/bar/questions.json,,,bar-gen-1232,draft,hard,0,A,correct-option-marked-incorrect,"275 is incorrect because it does not include the additional sales resulting from the increased social media engagement which drives addition"
functions/content-cpa/bar/questions.json,,,bar-gen-1252,draft,easy,2,C,wrong-option-marked-correct,"This is the actual cost less the standard cost, which is not the correct way to calculate price variance. Price variance focuses on the pric"
functions/content-cpa/bar/questions.json,,,bar-gen-1253,draft,hard,0,A,correct-option-marked-incorrect,"2,500 units is incorrect. This answer does not correctly calculate the weighted average contribution margin or account for the sales mix."
functions/content-cpa/bar/questions.json,,,bar-gen-1259,draft,hard,3,D,correct-option-marked-incorrect,"This answer is too high. It's likely a miscalculation involving incorrect weights or fixed cost amounts."
functions/content-cpa/bar/questions.json,,,bar-gen-1285,draft,medium,3,D,wrong-option-marked-correct,"The correct period is one year from when the financial statements are *issued or available to be issued*, not the balance sheet date."
functions/content-cpa/bar/questions.json,,,bar-gen-1369,draft,medium,2,C,wrong-option-marked-correct,"Technology's revenue of $50 million is exactly 10%, however, the combined revenue of Retail Sales and Financial Services alone already meets"
functions/content-cpa/bar/questions.json,,,bar-gen-1395,draft,easy,3,D,wrong-option-marked-correct,"The temporal method is an older term for the remeasurement method. While technically related, 'remeasurement method' is the correct and more"
functions/content-cpa/bar/questions.json,,,bar-gen-1423,draft,easy,2,C,wrong-option-marked-correct,"$1,000,000 is not the correct threshold. It may be a distractor based on other calculations."
functions/content-cpa/bar/questions.json,,,bar-gen-1483,draft,easy,3,D,wrong-option-marked-correct,"The fair value option requires that changes in fair value are reported in current income. A gain of $0 would only be correct if the fair val"
functions/content-cpa/bar/questions.json,,,bar-gen-1509,draft,medium,3,D,wrong-option-marked-correct,"Segment A is not reportable because its revenue ($7 million) is less than 10% of the total segment revenue ($50 million). Similarly, Segment"
functions/content-cpa/bar/questions.json,,,bar-gen-1524,draft,easy,1,B,correct-option-marked-incorrect,"Option B is incorrect because the bankruptcy provides significant information about the collectibility of the receivable at year-end, requir"
functions/content-cpa/bar/questions.json,,,bar-gen-1533,draft,medium,3,D,wrong-option-marked-correct,"The settlement of the lawsuit for a different amount than accrued is a Type I subsequent event requiring adjustment. The correct adjustment "
functions/content-cpa/bar/questions.json,,,bar-gen-1557,draft,hard,0,A,wrong-option-marked-correct,"Strategy A results in a ROE of 30%, whereas strategy B results in a ROE of 30%, so neither is better. The calculation of 1.5% is not correct"
functions/content-cpa/bar/questions.json,,,bar-gen-1557,draft,hard,2,C,wrong-option-marked-correct,"Strategy A results in a ROE of 30%, whereas strategy B results in a ROE of 30%, so neither is better. The calculation of 3.0% is not correct"
functions/content-cpa/bar/questions.json,,,bar-gen-1583,draft,hard,2,C,correct-option-marked-incorrect,"This is a smaller favorable variance, but it's derived from an incorrect calculation of the standard mix, actual mix, and subsequent applica"
functions/content-cpa/bar/questions.json,,,bar-9k-011,approved,easy,0,A,correct-option-marked-incorrect,"This answer is incorrect because it represents the incorrect calculation of the NPV. The present values were not calculated correctly."
functions/content-cpa/bar/questions.json,,,bar-9k-014,approved,medium,0,A,correct-option-marked-incorrect,"This answer is incorrect because the equation was used incorrectly."
functions/content-cpa/far/questions.json,,,far-d11-016,approved,medium,2,C,option-letter-prefix-mismatch,"B) $16,667 is CORRECT because cash-settled SARs are treated as liabilities and remeasured to fair value at each reporting date. The Year 1 c"
functions/content-cpa/far/questions.json,,,far-d15-003,approved,hard,1,B,option-letter-prefix-mismatch,"C) $125,000 is incorrect because it uses an incorrect calculation. It might be derived from applying the tax rate to the fair value of the e"
functions/content-cpa/far/questions.json,,,far-d15-003,approved,hard,2,C,option-letter-prefix-mismatch,"B) CORRECT: The difference between the equipment's fair value ($500,000) and its tax basis ($300,000) creates a taxable temporary difference"
functions/content-cpa/far/questions.json,,,far-d21-023,approved,medium,3,D,option-letter-prefix-mismatch,"B) CORRECT: Common stock and APIC represent the historical investment in the subsidiary. To maintain the original dollar value of that inves"
functions/content-cpa/far/questions.json,,,far-ext-inv-003,approved,hard,2,C,wrong-option-marked-correct,"While beginning inventory and purchases are correct, the conventional retail method specifically excludes markdowns from the cost-to-retail "
functions/content-cpa/far/questions.json,,,far-extra-156,approved,medium,0,A,wrong-option-marked-correct,"Correct! Nonspendable resources are inherently the most restricted as they cannot be spent."
functions/content-cpa/far/questions.json,,,far-extra-156,approved,medium,2,C,correct-option-marked-incorrect,"Incorrect. Restricted is the most restrictive SPENDABLE classification, but Nonspendable is more restrictive overall."
functions/content-cpa/far/questions.json,,,far-gen-1307,draft,easy,3,D,wrong-option-marked-correct,"This is the sum of actual warranty costs incurred during the year and the total estimated warranty expense, which is not the correct calcula"
functions/content-cpa/far/questions.json,,,far-gen-1326,draft,hard,0,A,correct-option-marked-incorrect,"This answer only includes the cash and cash equivalents that are not restricted. This is incorrect, as restricted cash should also be includ"
functions/content-cpa/far/questions.json,,,far-gen-1335,draft,hard,2,C,correct-option-marked-incorrect,"This is incorrect because the full tax benefit can be recognized since it is more likely than not. The tax benefit is only reduced to the am"
functions/content-cpa/far/questions.json,,,far-gen-1336,draft,easy,3,D,wrong-option-marked-correct,"This amount is not the correct profit calculation. Profit is calculated as the sales price less the carrying amount, which is $1,000,000 - $"
functions/content-cpa/far/questions.json,,,far-gen-1345,draft,easy,2,C,wrong-option-marked-correct,"This calculation would be correct if the revenue was recognized ratably for tax and entirely for book."
functions/content-cpa/far/questions.json,,,far-gen-1345,draft,easy,3,D,wrong-option-marked-correct,"This calculation would be correct if only one year is considered and the deferred tax liability is based on the $200,000 difference."
functions/content-cpa/far/questions.json,,,far-gen-1352,draft,hard,2,C,wrong-option-marked-correct,"This option only subtracts the uncollectible portion. While it is a step closer to the correct answer, it does not consider the 60-day avail"
functions/content-cpa/far/questions.json,,,far-gen-1357,draft,medium,3,D,wrong-option-marked-correct,"Grants restricted for specific purposes are recognized as revenue when the qualifying expenditures are incurred, not when cash is received. "
functions/content-cpa/far/questions.json,,,far-gen-1358,draft,medium,3,D,wrong-option-marked-correct,"This answer incorrectly calculates the lease liability. It seems to be adding the lease payment to the initial lease liability, which is not"
functions/content-cpa/far/questions.json,,,far-gen-1385,draft,hard,2,C,wrong-option-marked-correct,"This option incorrectly calculates the gain. While the new principal is $4,000,000, the correct calculation simply takes the difference betw"
functions/content-cpa/far/questions.json,,,far-gen-1395,draft,medium,2,C,wrong-option-marked-correct,"This option incorrectly includes the cash restricted for plant expansion, which is classified as noncurrent, in addition to the correct curr"
functions/content-cpa/far/questions.json,,,far-gen-1396,draft,medium,1,B,wrong-option-marked-correct,"B) $180,000 is the correct depreciation expense for 2024. The double-declining balance rate is 40%. 2023 depreciation is $200,000 ($500,000 "
functions/content-cpa/far/questions.json,,,far-gen-1396,draft,medium,2,C,wrong-option-marked-correct,"C) $200,000 is the depreciation expense for 2023, not 2024. Make sure to carefully read the question and provide the answer for the correct "
functions/content-cpa/far/questions.json,,,far-gen-1397,draft,hard,0,A,wrong-option-marked-correct,"A modification always requires analysis to determine if incremental compensation expense needs to be recorded. Zero is only the correct answ"
functions/content-cpa/far/questions.json,,,far-gen-1397,draft,hard,3,D,wrong-option-marked-correct,"This answer is double the correct amount. It likely results from incorrectly using the $20 fair value of the modified option without conside"
functions/content-cpa/far/questions.json,,,far-gen-1423,draft,hard,3,D,correct-option-marked-incorrect,"$250,000 is the original depreciation expense with the incorrect remaining useful life calculation ($1,600,000 - $400,000)/4."
functions/content-cpa/far/questions.json,,,far-gen-1431,draft,easy,2,C,wrong-option-marked-correct,"The 5% threshold is not relevant in determining major fund status; the correct threshold for *other* funds is 10%, and this rule doesn't app"
