file,course,section,question_id,status,difficulty,option_key,option_letter,issues,sample
content/cpa/far/questions.json,cpa,far,far-9k-013,approved,hard,1,B,correct-option-marked-incorrect,"Incorrect. The lease is a finance lease, not an operating lease."
content/cpa/far/questions.json,cpa,far,far-9k-013,approved,hard,2,C,wrong-option-marked-correct,"Correct. The lease is a finance lease, and the lease liability is the present value of lease payments."
content/cpa/far/questions.json,cpa,far,far-9k-015,approved,hard,2,C,correct-option-marked-incorrect,"Incorrect. The Amortization expense is $60,000"
content/cpa/far/questions.json,cpa,far,far-9k-017,approved,medium,0,A,wrong-option-marked-correct,"This is the closest answer to the correct COGS amount calculated using the weighted-average method."
content/cpa/isc/questions.json,cpa,isc,isc-138,approved,medium,2,C,option-letter-prefix-mismatch,"B) CORRECT: Comprehensive security logging, encompassing authentication events, access to sensitive data, configuration changes, and securit"
content/cpa/isc/questions.json,cpa,isc,isc-add-014,approved,hard,2,C,option-letter-prefix-mismatch,"B) CORRECT: A qualified SOC 2 report requires the user auditor to determine the relevance of the qualified control to their audit, assess co"
content/cpa/isc/questions.json,cpa,isc,isc-d10-003,approved,hard,3,D,option-letter-prefix-mismatch,"B) CORRECT: Privileged accounts possess elevated permissions, enabling them to bypass standard security measures. If compromised, an attacke"
content/cpa/isc/questions.json,cpa,isc,isc-d10-004,approved,medium,3,D,option-letter-prefix-mismatch,"B) CORRECT: Configurable controls should be documented, access-restricted, subject to change management, and periodically reviewed to ensure"
content/cpa/isc/questions.json,cpa,isc,isc-d10-008,approved,medium,3,D,option-letter-prefix-mismatch,"B) Actively blocks malicious traffic in real-time (inline with network traffic) rather than just detecting and alerting — the IPS can drop m"
content/cpa/isc/questions.json,cpa,isc,isc-d10-025,approved,medium,3,D,option-letter-prefix-mismatch,"B) CORRECT: Transaction log backups capture every database transaction, allowing for point-in-time recovery. This means you can restore the "
content/cpa/isc/questions.json,cpa,isc,isc-d11-002,approved,medium,3,D,option-letter-prefix-mismatch,"B) CORRECT: ISO 27001 mandates a comprehensive ISMS including risk assessment, a Statement of Applicability (SoA) linking controls to risks,"
content/cpa/isc/questions.json,cpa,isc,isc-d11-005,approved,hard,3,D,option-letter-prefix-mismatch,"B) CORRECT: RBAC centralizes access management by assigning permissions to roles (e.g., AP Clerk, Controller) instead of individual users. T"
content/cpa/isc/questions.json,cpa,isc,isc-d11-020,approved,medium,3,D,option-letter-prefix-mismatch,"B) This option is CORRECT because it encompasses the entire vulnerability management lifecycle, including asset discovery, regular scanning,"
content/cpa/isc/questions.json,cpa,isc,isc-d12-007,approved,medium,3,D,option-letter-prefix-mismatch,"B) CORRECT: In IaaS, the customer manages the operating system, applications, data, identity and access management, and network configuratio"
content/cpa/isc/questions.json,cpa,isc,isc-d12-021,approved,easy,3,D,option-letter-prefix-mismatch,"B) CORRECT: Multi-factor authentication (MFA) strengthens security by requiring verification from at least two distinct categories: knowledg"
content/cpa/isc/questions.json,cpa,isc,isc-d13-008,approved,medium,3,D,option-letter-prefix-mismatch,"B) CORRECT: IT General Controls (ITGCs) and application controls are both crucial for ensuring the reliability of financial reporting system"
content/cpa/isc/questions.json,cpa,isc,isc-d13-009,approved,hard,3,D,option-letter-prefix-mismatch,"B) Maintaining a documented chain of custody is crucial because it establishes the integrity and authenticity of the evidence from collectio"
content/cpa/isc/questions.json,cpa,isc,isc-d13-016,approved,hard,3,D,option-letter-prefix-mismatch,"B) Container image scanning for vulnerabilities before deployment, image signing and provenance verification, least-privilege runtime config"
content/cpa/isc/questions.json,cpa,isc,isc-d13-021,approved,hard,3,D,option-letter-prefix-mismatch,"B) CORRECT: Shor's algorithm, run on a sufficiently powerful quantum computer, poses a significant threat to RSA and ECC, which are fundamen"
content/cpa/isc/questions.json,cpa,isc,isc-d6-017,approved,medium,3,D,option-letter-prefix-mismatch,"B) Penetration testing goes beyond simply identifying vulnerabilities; it actively attempts to exploit them to determine the real-world impa"
content/cpa/isc/questions.json,cpa,isc,isc-d8-011,approved,medium,1,B,correct-option-marked-incorrect,"DNS cache poisoning, also known as DNS spoofing, involves injecting false DNS data into a DNS resolver's cache, causing users to be redirect"
content/cpa/isc/questions.json,cpa,isc,isc-itgc-001,approved,medium,2,C,self-contradictory-rationale-text,"Why option C is WRONG - Annual reviews without IT involvement are prone to errors and delays, leaving terminated employees' access active fo"
content/cpa/isc/questions.json,cpa,isc,isc-wc-111,approved,hard,1,B,wrong-option-marked-correct,"Hashing algorithms create a one-way, fixed-size 'fingerprint' of data, and cannot be reversed to recover the original information. AES-256 i"
content/cpa/isc/questions.json,cpa,isc,isc-gen-1152,draft,medium,3,D,wrong-option-marked-correct,"Increasing the frequency of manual audits is resource-intensive and only provides a snapshot in time. It doesn't prevent or automatically co"
content/cpa/isc/questions.json,cpa,isc,isc-gen-1193,draft,medium,3,D,wrong-option-marked-correct,"Subtracting from or mixing the values of RTO and RPO is not the correct application of the concepts. The values are derived from business im"
content/cpa/isc/questions.json,cpa,isc,isc-gen-1223,draft,medium,3,D,wrong-option-marked-correct,"Relying on users to manually correct data is inefficient and inconsistent. It also places the burden of data quality on end-users instead of"
content/cpa/reg/questions.json,cpa,reg,reg-cred-002,approved,easy,0,A,wrong-option-marked-correct,"While a $1,000 amount might seem plausible, it's not the correct value for the Child Tax Credit. The current Child Tax Credit is $2,000 per "
content/cpa/reg/questions.json,cpa,reg,reg-d2-013,approved,medium,3,D,option-letter-prefix-mismatch,"B) Is treated as a contribution of money to the partnership, increasing basis: Correct. Under IRC §752, an increase in a partner's share of "
content/cpa/reg/questions.json,cpa,reg,reg-easy-exp-019,approved,easy,0,A,option-letter-prefix-mismatch,"D) INCORRECT: The deductible amount is not arbitrarily limited to $1,000. The IRC §248 allows for a deduction of up to $5,000, and the full "
content/cpa/reg/questions.json,cpa,reg,reg-easy-exp-019,approved,easy,3,D,option-letter-prefix-mismatch,"A) CORRECT: IRC §248 allows a newly formed corporation to deduct up to $5,000 of organizational expenditures in its first year. Since the co"
content/cpa/reg/questions.json,cpa,reg,reg-ind-015,approved,medium,1,B,wrong-option-marked-correct,"$3,600 was the maximum Child Tax Credit amount for 2021 only, as part of temporary pandemic relief measures. This is not the correct amount "
content/cpa/reg/questions.json,cpa,reg,reg-ind-015,approved,medium,2,C,wrong-option-marked-correct,"$3,000 was the maximum Child Tax Credit amount for qualifying children ages 6-17 in 2021 only, as part of temporary pandemic relief measures"
content/cpa/reg/questions.json,cpa,reg,reg-ind-053,approved,hard,0,A,wrong-option-marked-correct,"This answer uses the full $3,000 child care expense without applying the correct credit percentage of 20% or incorrectly assumes the taxpaye"
content/cpa/reg/questions.json,cpa,reg,reg-gen-0918,draft,medium,1,B,wrong-option-marked-correct,"While $1,000 is a potential penalty amount, it's not necessarily the correct amount in all cases. The penalty is the *greater* of $1,000 or "
content/cpa/reg/questions.json,cpa,reg,reg-gen-0948,draft,medium,2,C,wrong-option-marked-correct,"While the reason is partially correct, it doesn't highlight the crucial element of prior dealings establishing apparent authority."
content/cpa/reg/questions.json,cpa,reg,reg-gen-0967,draft,hard,0,A,self-contradictory-rationale-text,"The medical expense deduction is limited to the amount exceeding 7.5% of AGI. Qualified medical expenses are $4,000 (premiums) + $6,000 (doc"
content/cpa/reg/questions.json,cpa,reg,reg-gen-0969,draft,medium,0,A,wrong-option-marked-correct,"Single would only be correct if Harold did not maintain a household for a qualifying child or other qualifying relative."
content/cpa/reg/questions.json,cpa,reg,reg-gen-0973,draft,medium,3,D,correct-option-marked-incorrect,"This option Ddds the health insurance deduction to the full self-employment tax amount before dividing by two. It also uses an incorrect SE "
content/cpa/reg/questions.json,cpa,reg,reg-gen-0980,draft,medium,3,D,wrong-option-marked-correct,"This answer would be correct only if their income were too high to qualify, which is not the case here."
content/cpa/reg/questions.json,cpa,reg,reg-gen-1039,draft,medium,3,D,wrong-option-marked-correct,"Although technically correct, the question asks about the *net* gain or loss. This response fails to net the section 1231 gains and losses."
content/cpa/reg/questions.json,cpa,reg,reg-gen-1048,draft,hard,1,B,correct-option-marked-incorrect,"Incorrect. This includes an incorrect amortization amount, and does not include the initial $5,000 deduction."
content/cpa/reg/questions.json,cpa,reg,reg-gen-1051,draft,medium,1,B,wrong-option-marked-correct,"Ordinary income is not the correct character of the gain; the liquidation generally results in capital gain or loss."
content/cpa/reg/questions.json,cpa,reg,reg-gen-1051,draft,medium,3,D,wrong-option-marked-correct,"Ordinary income is not the correct character of the gain; the liquidation generally results in capital gain or loss, and $90,000 is the tota"
content/cpa/reg/questions.json,cpa,reg,reg-gen-1058,draft,easy,0,A,correct-option-marked-incorrect,"A) $65,000 is incorrect because it doesn't properly account for the limitation on deducting expenses allocated to tax-exempt income when cal"
content/cpa/reg/questions.json,cpa,reg,reg-gen-1058,draft,easy,1,B,wrong-option-marked-correct,"B) $70,000 is the correct answer. DNI for a simple trust includes taxable income (dividends) plus tax-exempt income, less deductible expense"
content/cpa/reg/questions.json,cpa,reg,reg-gen-1078,draft,hard,1,B,wrong-option-marked-correct,"This is close to the correct answer, but misses some of the amortization calculation."
content/cpa/reg/questions.json,cpa,reg,reg-gen-1089,draft,medium,0,A,correct-option-marked-incorrect,"This answer is incorrect because it does not correctly add back the trustee fees that were allocated to income."
content/cpa/reg/questions.json,cpa,reg,reg-gen-1137,draft,easy,1,B,wrong-option-marked-correct,"A $20,000 capital gain would be correct if Amy received $40,000, not $50,000, in liquidation proceeds ($40,000 - $20,000 basis = $20,000 gai"
content/cpa/reg/questions.json,cpa,reg,reg-gen-1138,draft,hard,1,B,correct-option-marked-incorrect,"B) $26,250 is incorrect because it incorrectly applies the NOL carryforward rules. The NOL carryforward from C corporation years can offset "
content/cpa/reg/questions.json,cpa,reg,reg-gen-1138,draft,hard,2,C,wrong-option-marked-correct,"C) $31,500 is the correct answer. The built-in gain is the lesser of the total built-in gain ($150,000) or the S corporation's taxable incom"
content/cpa/reg/questions.json,cpa,reg,reg-gen-1181,draft,medium,0,A,wrong-option-marked-correct,"This answer represents 50% of the dividend, which would be correct if ABC owned less than 20% of XYZ."
content/cpa/reg/questions.json,cpa,reg,reg-gen-1187,draft,medium,0,A,correct-option-marked-incorrect,"This answer is incorrect because it doesn't consider the disallowed loss John had when selling the warehouse to Alpha."
content/cpa/reg/questions.json,cpa,reg,reg-gen-1190,draft,easy,3,D,wrong-option-marked-correct,"$1,500 is not the correct amount. The maximum capital loss deduction for individuals is $3,000."
content/cpa/reg/questions.json,cpa,reg,reg-gen-1222,draft,medium,3,D,wrong-option-marked-correct,"This is John's original cost basis plus the depreciation taken, which is not the correct calculation."
content/cpa/reg/questions.json,cpa,reg,reg-gen-1227,draft,hard,0,A,wrong-option-marked-correct,"This would be correct if the entire amount of insurance proceeds was reinvested. However, only $600,000 was reinvested."
content/cpa/reg/questions.json,cpa,reg,reg-gen-1238,draft,medium,1,B,wrong-option-marked-correct,"This option fails to recognize the correct calculation of the capital loss deduction limitation."
content/cpa/reg/questions.json,cpa,reg,reg-gen-1238,draft,medium,2,C,wrong-option-marked-correct,"This option fails to recognize the correct calculation of the capital loss deduction limitation and exceeds the statutory limit."
content/cpa/reg/questions.json,cpa,reg,reg-gen-1238,draft,medium,3,D,wrong-option-marked-correct,"This option fails to recognize the correct calculation of the capital loss deduction limitation and exceeds the statutory limit. It also use"
content/cpa/reg/questions.json,cpa,reg,reg-gen-1246,draft,medium,3,D,wrong-option-marked-correct,"Alice has a net capital loss, so she will be able to deduct some amount. The question is determining the correct amount given the $3,000 lim"
content/cpa/reg/questions.json,cpa,reg,reg-gen-1258,draft,hard,1,B,wrong-option-marked-correct,"This option would be correct if we simply added the total losses together and subtracted the total gains, but we must first offset losses ag"
content/cpa/reg/questions.json,cpa,reg,reg-gen-1258,draft,hard,2,C,wrong-option-marked-correct,"This option represents the total short-term capital loss before offsetting with the short-term capital gain. This is not the correct procedu"
content/cpa/reg/questions.json,cpa,reg,reg-gen-1258,draft,hard,3,D,wrong-option-marked-correct,"This option represents the total of all gains and losses without offsetting. This is not the correct procedure."
content/cpa/reg/questions.json,cpa,reg,reg-gen-1285,draft,easy,2,C,correct-option-marked-incorrect,"C) $27,000 is incorrect because while it represents 90% of the current year's tax liability, it's higher than 100% of the prior year's tax l"
content/cpa/reg/questions.json,cpa,reg,reg-gen-1294,draft,hard,1,B,correct-option-marked-incorrect,"This answer likely results from incorrectly calculating the net earnings subject to self-employment tax or using an incorrect tax rate."
content/cpa/reg/questions.json,cpa,reg,reg-gen-1300,draft,easy,1,B,wrong-option-marked-correct,"This number appears to be arbitrarily chosen and does not follow the correct self-employment tax calculation rules."
content/cpa/reg/questions.json,cpa,reg,reg-gen-1301,draft,medium,2,C,wrong-option-marked-correct,"This is the 2023 married filing jointly AMT exemption amount and is not the correct exemption amount for 2024."
content/cpa/reg/questions.json,cpa,reg,reg-gen-1312,draft,hard,0,A,correct-option-marked-incorrect,"Incorrect. This amount does not properly include the gambling winnings and the service award income."
content/cpa/reg/questions.json,cpa,reg,reg-gen-1330,draft,easy,2,C,wrong-option-marked-correct,"$1,400 is not the correct calculation based on the facts provided or the deduction limits."
content/cpa/reg/questions.json,cpa,reg,reg-gen-1332,draft,medium,2,C,wrong-option-marked-correct,"Since John maintains a home for his dependent child, he is eligible for Head of Household. Single filing status is not correct."
content/cpa/reg/questions.json,cpa,reg,reg-gen-1334,draft,easy,0,A,wrong-option-marked-correct,"While $2,500 is the maximum AOTC, it is not the correct amount based on the qualified expenses and the AOTC calculation."
content/cpa/reg/questions.json,cpa,reg,reg-gen-1334,draft,easy,2,C,wrong-option-marked-correct,"This option Coesn't reflect the correct calculation of the AOTC based on the qualified expenses."
content/cpa/reg/questions.json,cpa,reg,reg-gen-1334,draft,easy,3,D,wrong-option-marked-correct,"This option doesn't reflect the correct calculation of the AOTC based on the qualified expenses."
content/cpa/reg/questions.json,cpa,reg,reg-gen-1339,draft,medium,0,A,wrong-option-marked-correct,"This would be correct if their MAGI plus one-half of their Social Security benefits did not exceed the base amount."
content/cpa/reg/questions.json,cpa,reg,reg-gen-1340,draft,medium,3,D,correct-option-marked-incorrect,"This answer incorrectly calculates the self-employment tax liability, presumably by either not reducing by 7.65% or using incorrect tax rate"
content/cpa/reg/questions.json,cpa,reg,reg-gen-1345,draft,medium,1,B,wrong-option-marked-correct,"This is 20% of $3,000, which could be correct if their MAGI was below the phaseout threshold."
content/cpa/reg/questions.json,cpa,reg,reg-gen-1388,draft,hard,3,D,wrong-option-marked-correct,"Pro rata sharing is not the correct method for determining priority between a PMSI and a conflicting security interest."
content/cpa/reg/questions.json,cpa,reg,reg-gen-1399,draft,easy,3,D,wrong-option-marked-correct,"10 days is not the correct timeframe specified by the UCC for perfecting a PMSI in non-inventory and non-livestock goods."
content/cpa/reg/questions.json,cpa,reg,reg-9k-007,approved,medium,1,B,wrong-option-marked-correct,"Correct. The charitable contribution limit for corporations is 10% of taxable income (25% for certain years)."
content/cpa/reg/questions.json,cpa,reg,reg-9k-009,approved,medium,1,B,wrong-option-marked-correct,"Correct. Compensatory damages compensate for the loss suffered due to the breach."
content/cpa/reg/questions.json,cpa,reg,reg-9k-013,approved,medium,0,A,wrong-option-marked-correct,"This is not the correct calculation of 25% of the ordinary income."
content/cpa/reg/questions.json,cpa,reg,reg-9k-013,approved,medium,1,B,wrong-option-marked-correct,"This is not the correct calculation of 25% of the ordinary income."
content/cpa/reg/questions.json,cpa,reg,reg-9k-013,approved,medium,3,D,wrong-option-marked-correct,"This is not the correct calculation of 25% of the ordinary income."
content/cpa/reg/questions.json,cpa,reg,reg-9k-014,approved,easy,2,C,wrong-option-marked-correct,"This is not the correct calculation after the stock split."
content/cpa/reg/questions.json,cpa,reg,reg-9k-014,approved,easy,3,D,wrong-option-marked-correct,"This is not the correct calculation after the stock split."
content/cpa/tcp/questions.json,cpa,tcp,tcp-d5-001,approved,easy,3,D,wrong-option-marked-correct,"$12,950 was the standard deduction for single filers in a prior year, not 2025. Using outdated information is a common error, so always use "
content/cpa/tcp/questions.json,cpa,tcp,tcp-wc-021,approved,hard,1,B,wrong-option-marked-correct,"100% bonus depreciation was available in prior years but is not the correct percentage for property placed in service in 2024. Remember to c"
content/cpa/tcp/questions.json,cpa,tcp,tcp-wc-050,approved,medium,2,C,wrong-option-marked-correct,"$1,500 would be the credit if the taxpayer only had $1,500 in expenses plus 25% of the next $2,000. This is not the correct calculation for "
content/cpa/tcp/questions.json,cpa,tcp,tcp-gen-0894,draft,medium,3,D,wrong-option-marked-correct,"This option Dssumes that the entire $20,000 distribution is taxable. This is only correct if the distribution exceeds contributions, which i"
content/cpa/tcp/questions.json,cpa,tcp,tcp-gen-0912,draft,hard,2,C,wrong-option-marked-correct,"This option is derived from assuming a corporation had $2,000,000 in taxable income. This is also not the correct calculation to base estima"
content/cpa/tcp/questions.json,cpa,tcp,tcp-gen-0929,draft,easy,1,B,wrong-option-marked-correct,"25.00% is calculated by dividing State A sales by the sales in State B plus sales in State A ($500,000 / ($1,500,000 + $500,000)). This is n"
content/cpa/tcp/questions.json,cpa,tcp,tcp-gen-0966,draft,easy,2,C,wrong-option-marked-correct,"$175,000 is not the correct amount of the gain and does not represent a relevant threshold or calculation in this scenario."
content/cpa/tcp/questions.json,cpa,tcp,tcp-gen-0973,draft,hard,2,C,wrong-option-marked-correct,"This represents the book value plus the depreciation recapture. It is not the correct amount to be recognized."
content/cpa/tcp/questions.json,cpa,tcp,tcp-gen-1013,retired,medium,3,D,correct-option-marked-incorrect,"This answer uses an incorrect calculation of the RMD and the incorrect distribution deadline."
content/cpa/tcp/questions.json,cpa,tcp,tcp-gen-1038,draft,medium,1,B,wrong-option-marked-correct,"This answer is close, but it is calculated using a distribution period of 25, which would be correct for age 74."
content/cpa/tcp/questions.json,cpa,tcp,tcp-gen-1047,draft,hard,3,D,correct-option-marked-incorrect,"This answer is incorrect. It calculates the RMD for all accounts, including the Roth IRA, which is not subject to RMDs."
content/cpa/tcp/questions.json,cpa,tcp,tcp-gen-1075,draft,medium,2,C,wrong-option-marked-correct,"This option is a rounded number but is not the correct calculation. It is important to use the correct formula for RMD calculation."
content/cpa/tcp/questions.json,cpa,tcp,tcp-gen-1079,draft,hard,2,C,correct-option-marked-incorrect,"$17,400 is incorrect because it overestimates the amount needed to exceed the standard deduction. It might be obtained by an error in calcul"
content/cpa/tcp/questions.json,cpa,tcp,tcp-gen-1093,draft,hard,1,B,self-contradictory-rationale-text,"Option B is CORRECT because it accurately calculates the RMD for the Traditional IRA ($600,000 / 26.5 = $22,641.51) and the 401(k) ($300,000"
content/cpa/tcp/questions.json,cpa,tcp,tcp-gen-1125,draft,medium,3,D,wrong-option-marked-correct,"While they can contribute to both, the statement that there are no contribution limits is not entirely correct. Coverdell ESAs have a contri"
content/cpa/tcp/questions.json,cpa,tcp,tcp-gen-1133,draft,medium,2,C,wrong-option-marked-correct,"This answer incorrectly calculates the difference between the standard deduction and current itemized deductions. The correct calculation is"
content/cpa/tcp/questions.json,cpa,tcp,tcp-gen-1138,draft,easy,2,C,wrong-option-marked-correct,"This would be the taxable amount if the funds were NOT used for qualified education expenses but the correct answer is $0 because they ARE b"
content/cpa/tcp/questions.json,cpa,tcp,tcp-gen-1164,draft,easy,2,C,wrong-option-marked-correct,"The $129,000 amount is not the correct threshold for the first level of IRMAA surcharges for single filers in 2024."
content/cpa/tcp/questions.json,cpa,tcp,tcp-gen-1164,draft,easy,3,D,wrong-option-marked-correct,"The $150,000 amount is not the correct threshold for the first level of IRMAA surcharges for single filers in 2024."
content/cpa/tcp/questions.json,cpa,tcp,tcp-gen-1174,draft,medium,2,C,correct-option-marked-incorrect,"This answer is incorrect. The scholarship impacts the amount of qualified expenses, but it does not mean $5,000 is taxable."
content/cpa/tcp/questions.json,cpa,tcp,tcp-gen-1189,draft,hard,1,B,wrong-option-marked-correct,"This answer incorrectly calculates the GILTI inclusion, possibly by not properly deducting the QBAI deemed return or applying the correct de"
content/cpa/tcp/questions.json,cpa,tcp,tcp-gen-1189,draft,hard,2,C,correct-option-marked-incorrect,"This answer may be the result of only considering the tested income and not the Subpart F income or applying the wrong deduction."
content/cpa/tcp/questions.json,cpa,tcp,tcp-gen-1223,draft,medium,1,B,correct-option-marked-incorrect,"This is incorrect because it uses the gross tested income without subtracting tested losses."
content/cpa/tcp/questions.json,cpa,tcp,tcp-gen-1229,draft,medium,1,B,correct-option-marked-incorrect,"This answer uses the state's property as the apportionment factor, which is incorrect because State A uses a single sales factor."
content/cpa/tcp/questions.json,cpa,tcp,tcp-gen-1243,draft,hard,2,C,correct-option-marked-incorrect,"Incorrect. The calculation does not accurately reflect the tax implications of the salary and distribution amounts."
content/cpa/tcp/questions.json,cpa,tcp,tcp-gen-1248,draft,hard,2,C,correct-option-marked-incorrect,"C) $1,000,000 is incorrect because it doesn't accurately reflect the GILTI inclusion calculation before the section 250 deduction. It seems "
content/cpa/tcp/questions.json,cpa,tcp,tcp-gen-1265,draft,medium,3,D,correct-option-marked-incorrect,"Option D is incorrect because while B does get a $50 million basis in S's assets, P's gain is not solely based on the difference between the"
content/cpa/tcp/questions.json,cpa,tcp,tcp-gen-1298,draft,easy,0,A,wrong-option-marked-correct,"The correct answer is $1,600,000 because the tentative GILTI inclusion is calculated as tested income less the QBAI amount. In this case, $2"
content/cpa/tcp/questions.json,cpa,tcp,tcp-gen-1298,draft,easy,3,D,correct-option-marked-incorrect,"Option D is incorrect because it represents an inaccurate calculation of the tentative GILTI inclusion. It doesn't account for the full QBAI"
content/cpa/tcp/questions.json,cpa,tcp,tcp-gen-1324,draft,hard,2,C,correct-option-marked-incorrect,"This answer incorrectly calculates the GILTI inclusion, likely by using an incorrect percentage or misinterpreting the QBAI deduction."
content/cpa/tcp/questions.json,cpa,tcp,tcp-gen-1340,draft,medium,3,D,wrong-option-marked-correct,"This option uses the fair market value of assets instead of the purchase price, and does not use the correct ADSP formula."
